Question,CoT,Response
1. Why does cilantro taste like soap?,"The soapy taste of cilantro is due to aldehyde chemicals present in the herb, which are also found in soaps and some cleaning products. Some people have a genetic variation in the OR6A2 gene that makes them more sensitive to these aldehydes, causing them to perceive a soapy flavor.","Cilantro tastes like soap to some people due to a genetic variation in the OR6A2 gene, which increases sensitivity to aldehyde compounds found in both cilantro and soaps."
2. What gene is associated with cilantro aversion?,"Studies have shown that the OR6A2 gene, which encodes an olfactory receptor highly sensitive to aldehydes, is linked to cilantro aversion. People with certain variants of this gene are more likely to detect the soapy smell and taste in cilantro.","The OR6A2 gene is associated with cilantro aversion, as it affects how individuals perceive aldehydes present in the herb."
3. Can someone learn to like cilantro if they initially dislike it?,"Taste preferences can change over time due to repeated exposure and altered perception. Even if someone has a genetic sensitivity, gradually incorporating cilantro into dishes with other strong flavors can help them acclimate and possibly overcome the aversion.","Yes, people can learn to like cilantro through repeated exposure and by combining it with other flavors, even if they have a genetic predisposition to dislike it."
4. How does cilantro's chemical composition contribute to its flavor?,"Cilantro contains a variety of volatile compounds including linalool and several aldehydes. Linalool contributes floral and citrus notes, while aldehydes are responsible for the soapy flavor some people detect. The combination of these chemicals defines cilantro’s distinctive taste.","Cilantro's flavor comes from compounds like linalool (floral) and aldehydes (soapy), which create its unique and sometimes polarizing taste."
5. Why do some cultures use cilantro extensively in cooking while others do not?,"Cultural cuisines evolve based on local ingredients, climate, and tradition. In regions like South Asia, Latin America, and the Middle East, cilantro thrives and has become integral to culinary identity. Meanwhile, some Western cuisines rely more on herbs like parsley or basil, possibly influenced by historical trade and agriculture.","Cilantro is widely used in some cultures due to local availability and culinary tradition, while others favor different herbs based on climate and historical preferences."
6. Is there a difference between cilantro and coriander?,"In American English, “cilantro” refers to the fresh leaves of the plant, while “coriander” refers to its seeds. In British and other English dialects, “coriander” can refer to both. Botanically, they come from the same plant: Coriandrum sativum.","Yes, cilantro refers to the fresh leaves and coriander to the seeds of the same plant, Coriandrum sativum, although naming conventions vary by region."
7. Can cooking cilantro change its flavor?,"Heating cilantro can alter its volatile compounds, especially the delicate aldehydes and linalool, reducing its sharpness and making it milder. This is why raw cilantro tastes stronger than when it’s cooked.","Yes, cooking cilantro reduces its pungent and soapy flavors, making it taste milder."
8. Are there substitutes for cilantro in recipes for people who dislike it?,"People who dislike cilantro often substitute it with herbs that offer freshness without the aldehyde taste. Parsley, basil, and mint are common alternatives depending on the dish, though the flavor profile will differ.","Yes, parsley, basil, or mint can be used as substitutes for cilantro in recipes for those who dislike its taste."
"9. Is cilantro allergy common, and what are its symptoms?","Cilantro allergy is relatively rare but possible. Symptoms can include skin rashes, oral itching, swelling, or gastrointestinal distress. It differs from genetic aversion, which is about taste perception rather than immune response.",Cilantro allergy is uncommon but can cause symptoms like skin rashes or swelling; it’s different from a genetic aversion to its taste.
10. How does cilantro affect digestion and health?,"Cilantro contains antioxidants and has been used in traditional medicine for its digestive and anti-inflammatory properties. It may help reduce bloating, improve digestion, and even support detoxification due to its potential to bind with heavy metals.","Cilantro can aid digestion, reduce inflammation, and support detoxification, offering several health benefits."
11. What’s the evolutionary reason some people dislike cilantro?,"Genetic variations like the one in OR6A2 may have evolved to help humans avoid potentially harmful substances. Aldehydes can indicate spoilage or toxins in nature. So, sensitivity to these compounds might have offered evolutionary advantages in some environments.","Some people dislike cilantro due to evolved sensitivity to aldehydes, which may have helped early humans avoid toxic or spoiled foods."